[
  {
    "profile_version": "0.1.0",
    "profile_id": "interplanetary-criminal-slow-burner:bass:i1",
    "source": {
      "kind": "als_serum2_instance",
      "plugin": "Serum 2",
      "analysis_path": "als/analysis/interplanetary-criminal-slow-burner-serum.json",
      "analysis_slug": "interplanetary-criminal-slow-burner",
      "track": "Bass",
      "instance_index": 1,
      "preset_name": null,
      "bank": null,
      "vendor": null,
      "source_path": null
    },
    "classification": {
      "role_candidates": [
        "bass"
      ],
      "tone_tags": [
        "clean",
        "dark",
        "gritty",
        "modulated",
        "wide"
      ],
      "mix_tags": [
        "low_end_anchor",
        "side_heavy"
      ],
      "notes": [
        "Likely carries low-end weight or bass function.",
        "Detected unison-style width hints; likely side-heavy unless collapsed in the mix."
      ]
    },
    "summary": {
      "wavetable_refs": [
        "Analog/Basic Shapes.wav",
        "S2 Tables/Default Shapes.wav"
      ],
      "oscillator_count": 2,
      "filter_count": 1,
      "envelope_count": 4,
      "lfo_count": 10,
      "mod_route_count": 8
    },
    "synthesis": {
      "wavetables": {
        "osc_a": "Analog/Basic Shapes.wav",
        "osc_b": "Analog/Basic Shapes.wav",
        "osc_c": "S2 Tables/Default Shapes.wav"
      },
      "oscillators": {
        "osc_a": {
          "kParamOctave": -2.0,
          "kParamUnison": 2.0,
          "kParamVolume": 0.7165473814963121
        },
        "osc_b": {
          "kParamEnable": 1.0,
          "kParamVolume": 0.0
        }
      },
      "filters": {
        "filter_0": {
          "kParamDrive": 31.14035129547119,
          "kParamEnable": 1.0,
          "kParamFreq": 0.057946499437093735,
          "kParamKeyTrack": 1.0,
          "kParamReso": 39.912280440330505,
          "kParamType": "MgL18"
        }
      },
      "envelopes": {
        "env_0": {
          "kParamAttack": 0.0005153631860372526,
          "kParamCurve1": 40.00000059604645,
          "kParamCurve2": 60.00000238418579,
          "kParamCurve3": 60.00000238418579,
          "kParamRelease": 0.8700126462350769
        },
        "env_1": {
          "kParamAttack": 0.0005153631860372526,
          "kParamCurve1": 40.00000059604645,
          "kParamCurve2": 60.00000238418579,
          "kParamCurve3": 60.00000238418579,
          "kParamRelease": 0.014700845522658499
        },
        "env_2": {
          "kParamAttack": 0.0005153631860372526,
          "kParamCurve1": 40.00000059604645,
          "kParamCurve2": 60.00000238418579,
          "kParamCurve3": 60.00000238418579,
          "kParamRelease": 0.014700845522658499
        },
        "env_3": {
          "kParamCurve1": 50.0,
          "kParamCurve2": 66.60000000000001,
          "kParamCurve3": 66.60000000000001
        }
      },
      "lfos": {
        "lfo_0": {
          "kParamDefaultMode": 0.0,
          "kParamMode": "Envelope",
          "kParamRate": 2.2191734427191654
        },
        "lfo_1": {
          "kParamDefaultMode": 0.0,
          "kParamMode": "Free"
        },
        "lfo_2": {
          "kParamDefaultMode": 0.0,
          "kParamMode": "Free"
        },
        "lfo_3": {
          "kParamDefaultMode": 0.0,
          "kParamMode": "Free"
        },
        "lfo_4": {
          "kParamDefaultMode": 0.0,
          "kParamMode": "Free"
        },
        "lfo_5": {
          "kParamDefaultMode": 0.0,
          "kParamMode": "Free"
        },
        "lfo_6": {
          "kParamDefaultMode": 0.0,
          "kParamMode": "Free"
        },
        "lfo_7": {
          "kParamDefaultMode": 0.0,
          "kParamMode": "Free"
        },
        "lfo_8": {
          "kParamBeatSync": 0.0,
          "kParamDefaultMode": 0.0,
          "kParamDotted": 1.0,
          "kParamRate": 0.10000069729266844,
          "kParamRate10x": 1.0,
          "kParamTriplets": 1.0,
          "kParamType": "Lorenz"
        },
        "lfo_9": {
          "kParamBeatSync": 0.0,
          "kParamDefaultMode": 0.0,
          "kParamDotted": 1.0,
          "kParamRate": 0.10000069729266844,
          "kParamRate10x": 1.0,
          "kParamTriplets": 1.0,
          "kParamType": "Rossler"
        }
      },
      "mod_matrix": {
        "slot_0": {
          "source": "LFO3",
          "source_raw": [
            6,
            0
          ],
          "dest_module": "WTOsc",
          "dest_instance": 0,
          "dest_param": "kParamWarp",
          "amount": 18.42
        },
        "slot_1": {
          "source": "LFO3",
          "source_raw": [
            6,
            0
          ],
          "dest_module": "VoiceFilter",
          "dest_instance": 0,
          "dest_param": "kParamFreq",
          "amount": 15.79
        },
        "slot_2": {
          "source": "ModWheel?",
          "source_raw": [
            25,
            0
          ],
          "dest_module": "Oscillator",
          "dest_instance": 1,
          "dest_param": "kParamOctave",
          "amount": 16.8
        },
        "slot_3": {
          "source": "Macro7?",
          "source_raw": [
            20,
            6
          ],
          "dest_module": "VoiceFilter",
          "dest_instance": 0,
          "dest_param": "kParamFreq",
          "amount": 6.46
        },
        "slot_4": {
          "source": "LFO3",
          "source_raw": [
            6,
            26
          ],
          "dest_module": "FXFilter",
          "dest_instance": 3,
          "dest_param": "kParamWet",
          "amount": 29.82
        },
        "slot_5": {
          "source": "Random?",
          "source_raw": [
            27,
            0
          ],
          "dest_module": "WTOsc",
          "dest_instance": 0,
          "dest_param": "kParamWarp",
          "amount": 5.7
        },
        "slot_6": {
          "source": "KeyTrack?",
          "source_raw": [
            28,
            0
          ],
          "dest_module": "VoiceFilter",
          "dest_instance": 0,
          "dest_param": "kParamFreq",
          "amount": 23.68
        },
        "slot_7": {
          "source": "src38",
          "source_raw": [
            38,
            0
          ],
          "dest_module": "Oscillator",
          "dest_instance": 1,
          "dest_param": "kParamOctave",
          "amount": -5.21
        }
      },
      "global": {
        "kParamLegato": 1.0,
        "kParamLimitSameNotePolyphony": 1.0,
        "kParamMasterVolume": 0.32727210580576704,
        "kParamMonoToggle": 1.0,
        "kParamPortamentoTime": 0.04813766359712606,
        "kParamS1Compatibility": 1.0
      },
      "effects": null
    },
    "audio_reference": {
      "status": "not_rendered",
      "render_paths": [],
      "descriptor_path": null
    },
    "confidence": {
      "source": 0.95,
      "classification": 0.45,
      "mix_hints": 0.35
    }
  },
  {
    "profile_version": "0.1.0",
    "profile_id": "interplanetary-criminal-slow-burner:break-bass:i2",
    "source": {
      "kind": "als_serum2_instance",
      "plugin": "Serum 2",
      "analysis_path": "als/analysis/interplanetary-criminal-slow-burner-serum.json",
      "analysis_slug": "interplanetary-criminal-slow-burner",
      "track": "Break Bass",
      "instance_index": 2,
      "preset_name": null,
      "bank": null,
      "vendor": null,
      "source_path": null
    },
    "classification": {
      "role_candidates": [
        "bass"
      ],
      "tone_tags": [
        "clean",
        "dark",
        "modulated"
      ],
      "mix_tags": [
        "low_end_anchor"
      ],
      "notes": [
        "Likely carries low-end weight or bass function."
      ]
    },
    "summary": {
      "wavetable_refs": [
        "S2 Tables/Default Shapes.wav"
      ],
      "oscillator_count": 2,
      "filter_count": 1,
      "envelope_count": 4,
      "lfo_count": 1,
      "mod_route_count": 9
    },
    "synthesis": {
      "wavetables": {
        "osc_a": "S2 Tables/Default Shapes.wav",
        "osc_b": "S2 Tables/Default Shapes.wav",
        "osc_c": "S2 Tables/Default Shapes.wav"
      },
      "oscillators": {
        "osc_a": {
          "kParamOctave": -3.0
        },
        "osc_b": {
          "kParamEnable": 1.0,
          "kParamOctave": -2.0,
          "kParamVolume": 1.0
        }
      },
      "filters": {
        "filter_0": {
          "kParamEnable": 1.0,
          "kParamFreq": 0.24761664867401123,
          "kParamReso": 7.456140220165253,
          "kParamType": "MgL18"
        }
      },
      "envelopes": {
        "env_0": {
          "kParamCurve1": 50.0,
          "kParamCurve2": 66.60000000000001,
          "kParamCurve3": 66.60000000000001,
          "kParamRelease": 0.3597202976187394
        },
        "env_1": {
          "kParamCurve1": 50.0,
          "kParamCurve2": 66.60000000000001,
          "kParamCurve3": 66.60000000000001,
          "kParamDecay": 0.031249999999999584,
          "kParamSustain": 0.0
        },
        "env_2": {
          "kParamCurve1": 50.0,
          "kParamCurve2": 68.8058853149414,
          "kParamCurve3": 66.60000000000001,
          "kParamDecay": 0.3423062083529006,
          "kParamSustain": 0.0
        },
        "env_3": {
          "kParamCurve1": 50.0,
          "kParamCurve2": 66.60000000000001,
          "kParamCurve3": 66.60000000000001
        }
      },
      "lfos": {
        "lfo_0": {
          "kParamDefaultMode": 0.0,
          "kParamMode": "Free",
          "kParamRate": 0.4187670204883431
        }
      },
      "mod_matrix": {
        "slot_0": {
          "source": "src32",
          "source_raw": [
            32,
            0
          ],
          "dest_module": "FXUtils",
          "dest_instance": 5,
          "dest_param": "kParamWidth",
          "amount": 100.0
        },
        "slot_1": {
          "source": "LFO1",
          "source_raw": [
            4,
            29
          ],